{
  "$schema": "https://json-schema.org/draft/2020-12/schema",
  "$id": "https://api.tarlaanaliz.com/schemas/edge/intake_manifest.v1.schema.json",
  "title": "IntakeManifest",
  "description": "İstasyona alınan batch manifesti — chain-of-custody kanıt kaydı. KR-072 + KR-073 kanonik. SSOT Uyum: 1.2.0 (2026-02-24).\nDEĞİŞİKLİK NOTU: drone_model alanı DroneType enum'una bağlandı (drone-agnostik mimari, KR-015 + KR-030). Drone whitelist drone_registry.yaml üzerinden yapılır.",
  "type": "object",
  "unevaluatedProperties": false,
  "required": [
    "batch_id",
    "kiosk_id",
    "operator_id",
    "card_id",
    "drone_serial",
    "drone_model",
    "files",
    "signature",
    "av_scan_result",
    "created_at"
  ],
  "properties": {
    "batch_id": {
      "type": "string",
      "pattern": "^BATCH_[0-9]{8}_[0-9]{6}_[A-Z0-9]{4}$",
      "description": "Batch kimliği. Format: BATCH_YYYYMMDD_HHMMSS_XXXX. Eşleştirme hiyerarşisi: MissionID → BatchID → FieldID."
    },
    "kiosk_id": {
      "type": "string",
      "description": "Hangi istasyondan yüklendiği. mTLS sertifikası ile eşleşmeli."
    },
    "operator_id": {
      "type": "string",
      "description": "İşlemi yapan operatörün user_id değeri. Audit log için kritik (PII değil, pseudonymous)."
    },
    "card_id": {
      "type": "string",
      "description": "SD kart envanter kimliği. QR etiket veya fiziksel etiket ile eşleşmeli."
    },
    "drone_serial": {
      "type": "string",
      "description": "EXIF'ten çıkarılan drone seri numarası. drone_registry.yaml'daki kayıtlı seri numaralarıyla whitelist kontrolü yapılır. Kayıtlı değilse batch REJECTED_QUARANTINE."
    },
    "drone_model": {
      "$ref": "../../enums/drone_type.enum.v1.json",
      "description": "Drone model enum değeri (drone-agnostik). DJI_MAVIC_3M birincil/önerilen; desteklenen diğer modeller enum'da kayıtlı. KR-015 + KR-030 + KR-034."
    },
    "mission_id": {
      "type": ["string", "null"],
      "format": "uuid",
      "description": "Eşleştirilen görev kimliği (opsiyonel). EXIF veya dosya adından çıkarılır. Bulunamazsa coğrafi eşleştirme denenir, yoksa manuel inceleme kuyruğu."
    },
    "field_id": {
      "type": ["string", "null"],
      "format": "uuid",
      "description": "Eşleştirilen tarla kimliği (opsiyonel). Coğrafi eşleştirme sonucu veya explicit."
    },
    "files": {
      "type": "array",
      "minItems": 1,
      "description": "İstasyona alınan dosyaların listesi. Her dosya için hash zorunlu.",
      "items": {
        "$ref": "#/$defs/FileEntry"
      }
    },
    "signature": {
      "type": "string",
      "description": "GPG/RSA dijital imza. Kiosk'un özel anahtarı ile imzalanır; platform kiosk'un public key'i ile doğrular."
    },
    "av_scan_result": {
      "$ref": "#/$defs/AvScanResult",
      "description": "AV tarama sonucu (AV1 — edge taraması). av_scan_result olmadan batch RELEASE edilemez."
    },
    "dataset_status": {
      "$ref": "../../enums/dataset_status.enum.v1.json",
      "description": "Dataset yaşam döngüsü durumu. KR-072 state machine. İstasyon tarafı: RAW_INGESTED → RAW_SCANNED_EDGE_OK → RAW_HASH_SEALED."
    },
    "available_bands": {
      "type": "array",
      "minItems": 4,
      "items": {
        "type": "string",
        "enum": ["GREEN", "RED", "RED_EDGE", "NIR", "BLUE", "LWIR"]
      },
      "description": "Sensörün ürettiği spektral bantlar. Minimum 4 bant zorunlu (GREEN + RED + RED_EDGE + NIR). Blue bant mevcutsa genişletilmiş analiz, LWIR mevcutsa termal pipeline etkinleşir. drone_capability_matrix.yaml ile çapraz doğrulanır. KR-018/KR-082 v1.2.0."
    },
    "created_at": {
      "type": "string",
      "format": "date-time",
      "description": "Manifest oluşturulma zamanı (ISO 8601)."
    }
  },
  "$defs": {
    "FileEntry": {
      "type": "object",
      "unevaluatedProperties": false,
      "required": ["filename", "size_bytes", "sha256_hash", "mime_type"],
      "properties": {
        "filename": {
          "type": "string",
          "description": "Dosya adı. Whitelist uzantıları: .tif, .tiff, .jpg, .jpeg, .raw, .dng."
        },
        "size_bytes": {
          "type": "integer",
          "minimum": 1
        },
        "sha256_hash": {
          "type": "string",
          "pattern": "^[a-f0-9]{64}$",
          "description": "SHA-256 özet değeri. Hash uyuşmazlığı → REJECTED_QUARANTINE."
        },
        "mime_type": {
          "type": "string",
          "enum": ["image/tiff", "image/jpeg", "image/x-raw", "image/x-dng"]
        },
        "captured_at": {
          "type": ["string", "null"],
          "format": "date-time",
          "description": "EXIF'ten çekim zamanı."
        },
        "gps_lat": {
          "type": ["number", "null"],
          "description": "GPS enlemi (WGS84)."
        },
        "gps_lon": {
          "type": ["number", "null"],
          "description": "GPS boylamı (WGS84)."
        }
      }
    },
    "AvScanResult": {
      "type": "object",
      "unevaluatedProperties": false,
      "required": ["status", "scanned_at", "engine_id", "signatures_version"],
      "properties": {
        "status": {
          "type": "string",
          "enum": ["CLEAN", "THREAT_FOUND", "SCAN_ERROR"],
          "description": "CLEAN olmadan batch RELEASE edilemez."
        },
        "scanned_at": {
          "type": "string",
          "format": "date-time"
        },
        "engine_id": {
          "type": "string",
          "description": "AV motor kimliği."
        },
        "signatures_version": {
          "type": "string",
          "description": "AV imza veri tabanı versiyonu."
        },
        "findings": {
          "type": "array",
          "items": {
            "type": "object",
            "properties": {
              "file": { "type": "string" },
              "threat_name": { "type": "string" },
              "threat_type": { "$ref": "../../enums/threat_type.enum.v1.json" }
            },
            "unevaluatedProperties": false
          }
        },
        "quarantined": {
          "type": "boolean",
          "description": "THREAT_FOUND durumunda true; dosyalar karantinaya alındı."
        }
      }
    }
  },
  "x-security-checklist": [
    "Tüm dosyaların SHA-256 hash'i doğrulandı mı?",
    "Dijital imza geçerli mi?",
    "AV taraması CLEAN mı?",
    "Dosya uzantıları whitelist'te mi?",
    "kiosk_id kayıtlı mı?",
    "drone_serial drone_registry.yaml'da kayıtlı mı?"
  ],
  "x-kr-ref": ["KR-072", "KR-073", "KR-015", "KR-030"],
  "x-ssot-version": "1.2.0",
  "x-updated": "2026-02-24"
}
