{
  "batch_id": "BATCH_20260615_080000_A1B2",
  "kiosk_id": "kiosk_diyarbakir_central_01",
  "operator_id": "user_60a7f1b8c9d4e5f6a7b8c9d3",
  "card_id": "SANDISK_32GB_SN987654321",
  "drone_serial": "1581F6HGBC0123",
  "drone_model": "DJI_MAVIC_3M",
  "mission_id": "a1b2c3d4-e5f6-7890-abcd-ef1234567890",
  "field_id": "b2c3d4e5-f6a7-8901-bcde-f12345678901",
  "files": [
    {
      "filename": "DJI_0001.tif",
      "size_bytes": 5242880,
      "sha256_hash": "a3f2b8c9d4e5f6a7b8c9d0e1f2a3b4c5d6e7f8a9b0c1d2e3f4a5b6c7d8e9f0a1",
      "mime_type": "image/tiff",
      "captured_at": "2026-06-15T07:15:23Z",
      "gps_lat": 37.9158,
      "gps_lon": 40.2181
    },
    {
      "filename": "DJI_0002.jpg",
      "size_bytes": 5198720,
      "sha256_hash": "b4c5d6e7f8a9b0c1d2e3f4a5b6c7d8e9f0a1a2b3c4d5e6f7a8b9c0d1e2f3a4b5",
      "mime_type": "image/jpeg",
      "captured_at": "2026-06-15T07:15:28Z",
      "gps_lat": 37.9160,
      "gps_lon": 40.2185
    }
  ],
  "signature": "MEUCIQDx1y2z3a4b5c6d7e8f9g0h1i2j3k4l5m6n7o8p9q0r1s2t3u4v5w6x7y8z9A==",
  "av_scan_result": {
    "status": "CLEAN",
    "scanned_at": "2026-06-15T08:00:00Z",
    "engine_id": "clamav-edge-01",
    "signatures_version": "27304/2026-06-15"
  },
  "dataset_status": "RAW_INGESTED",
  "available_bands": ["GREEN", "RED", "RED_EDGE", "NIR"],
  "created_at": "2026-06-15T08:02:30Z"
}
